,sentence,trigger,event_type,tag
974,"This is absolutely amazing news. Finally, the Democrats are finally realizing that the American people support the rights of unborn children and may soon revamp their platform to accommodate the morals and values that at least half of this country possesses. Of course, I'm sure the Democrats would also like to start winning elections again. From the Los Angeles Times : After long defining itself as an undisputed defender of abortion rights, the Democratic Party is suddenly locked in an internal struggle over whether to redefine its position to appeal to a broader array of voters.",elections,17,1809
825,"reporter: they know little about their little girl, found by the side of the road days after she was born. she spent most of her life in an orphannage. now abby has a new life in california with the kramers and their two kids.",born,11,637
580,"American units advancing west of Basra have already secured the Rumeila oil field, whose daily output of 1.3 million barrels makes it Iraq's most productive.",secured,2,1209
84,"between 700 and 1,000. the task forces really, wolf are probably built around the m-2 bradley the basic infantry fighting vehicle. it is the equipment of choice for a task force like this to go into baghdad. it's cannon, it's ability to implace troops and fire through the firing ports in that bradley vehicle to take them in under protection. it's a very, very important piece of equipment. these are probably mechanized heavy task forces that have overhead aerial platforms to provide direct support. it's significant the degradation of the iraqi air defenses has allowed a-10s, predators, u-s, other assets to hover and loiter and provide the overhead protection to these task",fire,0,418
1484,"Immigration and Checkpoints Authority spokeswoman Ngoon Pei Ling said during the trial period the scanners would be placed at bus checkpoints, where passengers are already required to disembark for immigration purposes.",disembark,32,1352
152,"In interviews last year, Giuliani said Nathan gave him ``tremendous emotional support'' through his treatment for prostate cancer and as he led the city during the aftermath of the Sept. 11 terrorist attack on the World Trade Center.",attack,0,1356
910,"Baxley held up a stack of more than 800 e-mails from Floridians who he said have written him to support the bill. He said 62 House members, a majority, have endorsed his bill, and supporters include Attorney General Charlie Crist and groups representing Florida sheriffs, police chiefs and police officers.",written,15,1845
369,A two-day summit between British Prime Minister Tony Blair and US President George W. Bush ended here Tuesday with both countries trying to minimize splits on UN role in rebuilding Iraq after the ongoing US-led war against the country is over.,war,0,1511
1499,"Now, as you go from Saddam International Airport into town you see there are some big, wide divided highways there. Control of these highways will be crucial won't it",go,32,176
837,"we were praying that he would get here on time, unfortunately he missed it, but through e-mails, pictures, he actually seen him grow, so it turned out to be okay. it was just like he was there.",it,11,575
48,"You know, it's been going on for all these many -- what,",it,0,870
1247,how could so many people end up in prison for crimes they didn't commit,end up,27,350
1547,"we're told the russian president vladimir putin was greeted by prince charles as he arrived in london today. the music beginning as they enter. part of the formalities of a royal reception such as this. his private plane arrived at heathrow airport. putin and his wife left for the official reception that you're seeing now here in central london. we'll bring walter rodgers back in who's live outside buckingham palace. let's listen in for a few moments, roger, and then we'll talk about this reception and what it means. listening to ""god saved the queen."" her majesty with russian president, his wife and also prince charles sitting down with their guests. also with them prime minister tony blair. walter rodgers outside of buckingham palace as the royal reception here begins. first time for russian head of state to visit britain. more than 130 years, actually the last time was alexander ii in 1874. same type of fan fare and pomp to take place. walter rodgers, let's talk about if we could, the guest list. just looking at this group at this royal reception and, i'm even noticing some gentleman, probably a political and religious mix of sorts. how did the queen design the guest list for this incredible and historic event",arrived,32,662
202,"it is 11:00 a.m. on the east coast. from the cnn center in atlanta, i'm fred fred. a first here on ""cnn live today,"" a spiraling cycle of violence threatening the latest middle east peace efforts. this morning hamas vows revenge for an israeli missile attack. israeli hospital gun ships fired on a jeep in gaza. the strike targeted a hamas leader. and two other people were killed including a mother and bodyguard. mike hanna is tracking the latest developments from there. he joins us live with the details. mike",attack,0,596
261,"A short time ago we talked to a pilot at this base who has been to that Iraqi base and he too says he has signed that mural right on Saddam Hussein's sash. After he told us that, we asked him during his missions, and he's flown about 30 in the last two weeks, we asked him does he still have any artillery being fired at him",fired,0,191
1079,we are all saying that the resistance will continue despite the summit in aqaba.,summit,21,617
264,"And, as we listened to John King's report, we can tell you that President Bush has just -- his plane has just landed at Andrews Air Force Base, just close to the Washington area, the president having flown back to the United States from that meeting in Northern Ireland in Belfast with the British prime minister, Tony Blair. You just heard John reporting about it. They primarily talked about the war in Iraq, the aftermath of Iraq. But they also discussed the Middle East and, as well, getting the Northern Ireland peace process started up again. It has been said that Saddam Hussein ruled Iraq with an iron fist. I guess you can say in the past tense. His regime has left behind some disturbing evidence to support those claims. The abandoned secret police headquarters in Basra is just one example. ITN's Bill Neely is with the Royal Marines and he takes us on a tour of Basra's chamber of horrors.",Iraq,0,252
1198,"The answer is, these are my neighbors from Vermont and obviously we're going to support them. And obviously we're going to pray that there's fewer casualties...",casualties,24,50
1171,"On Monday, Anwar completed his sentence for a separate conviction on corruption charges, after the six-year sentence was reduced by one-third for good behavior. He then began serving the nine-year prison sentence for sodomy, his lawyers said.",sentence,22,1325
657,"Here to debate medical malpractice reform are consumer advocate Ralph Nader and Dr. Donald Palmisano, the president-elect of the American Medical Association.",elect,3,24
670,"Schrenko is a scumbag and, although she won't get any actual jail time, I hope the fine she pleads to is at least as much as what she stole. Otherwise, she's learned nothing.",stole,4,1953
1538,"Baghdad is now within striking distance as troops make their final thrust through the desert. Wrecked armor by the sides of the road suggests there has been some Iraqi opposition. But by and large, the Republican Guard has either been destroyed or has withdrawn. And the way seems to be open for coalition forces to close in on the city's southern limits. At daybreak, U.S. troops pushed through the outskirts of Karbala on the road to Baghdad, capturing a key bridge on the Euphrates River. Meanwhile, coalition commanders posted American special forces were now operating at will. These dramatic pictures show a raid on a presidential palace less than 60 miles from Baghdad. It seems to have been abandoned, but the United States said it was still on the trail of Saddam and his closest circle.",close in,32,198
380,"But despite issuing a host of tough decrees, Bremer has failed to stem the rampant crime and street violence plaguing the country.",violence,0,1114
409,The shocking level of destruction prompted U.S. lawmakers to expand the ban to cover almost all military ties with Indonesia.,destruction,0,1295
756,"But, they- they definitely need to take a back seat to some sort -- you know, some sort of Iraqi government there. I know they set up the council,  uh, interim council, but that hasn't gone,  you know, perfe- smoothly.  Um, they still -- Americans have been calling the shots. So, if they can just sort of make a -- be- get into more of a supportive role and,  you know, flex their muscles when they need to and maybe that will help- help,  uh,  squall some of the vi- the violence. I don't know.  Eh,  if they could've -- if they could've shored up the borders,  right after going in there, that would've been a -- that would've been a- a big plus, you know.  I don't know if that could, uh,  if that's a -- plausible goal or not because, uh, it's just that- that -- a lot of that's, you know,  uh, weapons and terrorists have been, you know, getting through the borders, probably from Syria.",set up,6,959
1319,I do however look more carefully at the top management team of a company with a CEO/Chair before investing. It is important that you can get a sense of the trustworthiness of the CEO. Is there high turnover among senior managers,turnover,31,2008
1207,"Gregory Lynch, the father of Jessica Lynch, and Jessica's mother talking to reporters, saying they have talked to her today, both before and after surgery, that she says she's feeling good. They say she will be good. But they said the doctors did go in and apparently do some work on her spinal cord or spinal column. He said to relieve some pressure on a nerve. They were concerned because she didn't have feeling in her feet. They did go on to say the doctors could not find either bullet or knife entry wounds, suggesting that her broken bones came from some other source, and it is not clear yet. Her parents said they don't know yet what caused their daughter's injuries.",wounds,24,206
1215,"6:03 a.m. eastern time, seven americans who had been prisoners of war in iraq make a public appearance at the medical center in germany. they say they're looking forward to going home, which relatives of one former p.o.w. say could happen as soon as tomorrow. officials at the hospital say the sev reason in good shape and their prognosis is excellent, even though three have gunshot wounds. 6:21 eastern time, 2:21 p.m. in iraq, iraqi protesters demonstrate outside a baghdad mosque, opposing what they call the u.s. occupation, and saying any new iraqi government must represent the people. 6:33 a.m., cnn's jane arraf report from kirkuk that local authorities and u.s. investigators are still mystified by a graveyard on a military base abandoned by the old iraqi regime. there are hundreds of unmarked graves, apparently dating back to the 1991 gulf war, or before. but it's not clear whether the people buried there are victims of regime atrocities, or whether it's simply a military graveyard. 7:05 a.m., u.s. central command says another top baath party official has been captured. he was handed over to coalition special forces by iraqi kurds last night. 8:10 a.m., abu dhabi tv broadcasts videotape which it says shows saddam hussein in a baghdad neighborhood last wednesday, april 9th, the day the city fell to coalition troops. the network has not said where it got the tape. there's no way to confirm when it was shot or whether the man in the video is really saddam hussein.",wounds,24,449
667,"For those of you not from around these parts, Linda Schrenko WAS the State of Georgia's Superintendant of schools. It seems that in recent years, instead of doing the people's business, good ole Linda has spent her time stealing over 600 grand in Federal Education funds. She used it for various things, but the favorite is the nine grand she spent on a facelift.",stealing,4,1949
880,"Shares of Martha Stewart Living Omnimedia , a company whose name is so breathtakingly self-promoting it makes me long for the days when every single entity involve in real estate or casinos was called Trump, continues to soar; it rose $1.78, or 7.29%, on news that the company's namesake will star in a new TV show once she, er... gets out of prison. Now, I know there have been succesful companies that dealt with crooks (Warner Communications, which started as a merger between business in the three most mob-influenced industries around, comes to mind), but it's a gamble and not a business strategy.",gets out,14,1980
1138,"The Iraqi government released a video of Saddam, in uniform, meeting with his son Qusai, the commander of the Republican Guard, and the defense minister, Gen. Sultan Hashim Ahmad. It was unclear when the video was made.",meeting,21,1222
1309,Where the trial's at.,trial,29,762
1337,"Cheeks, a former Sixers star, is believed to be Philadelphia's top choice to replace Larry Brown, who resigned last week as coach and was introduced Monday as the coach of the Detroit Pistons.",resigned,31,1489
319,"Reports to the Security Council on Friday by Blix and chief nuclear inspector Mohammed ElBaradei praised Iraq's recent compliance. But inspectors also questioned Iraq's motivation, as it began to give the inspectors what they wanted only when the threat of war became immediate.",war,0,1164
796,"Hunter, 34, filed for divorce in Los Angeles Superior Court, citing irreconcilable differences with the 58-year-old rock star to whom she has been married for nearly 13 years.",divorce,9,1138
658,"But I mean you're attacking the CIA for putting him in, when it was -- the problem was Khomeini.",putting,3,59
1327,") and hope for an uptick in demand before they would have to come clean. Both companies have been penalized for these actions and have continued to restructure operations, sell assets, and layoff employees. Cisco, on the other hand, was able to take one huge restructuring charge in 2001 and move forward. Their ability to do this and have it work (so far) indicates a very deep and impressive understanding of their organization. Especially when compared to its competitors, Cisco seems to be back in fighting form due to it's ability to rapidly assess its organizational structure and reconfigure to meet the changing market. Not bad for a company with a hangover",layoff,31,2016
791,A judge ruled in February that depositions in the divorce case will remain confidential.,divorce,9,1232
622,Silas is taking over a team that lost 65 games and will pin its future on the high school phenom LeBron James.,taking over,3,1493
1031,"Jordan's electoral law bans Jordanians from contesting the polls if they were convicted of any crime, except political, and sentenced to more than one year in jail.",convicted,18,1403
1599,Afterwards Shalom was to fly on to London for talks with British Prime Minister Tony Blair and Foreign Secretary Jack Straw.,fly,32,1104
793,"reporter: prince william is most at ease with those closest to him. those he can trust not to run to britain's gossipy feed ya. despite prince charles' ugly divorce with princess di anna, the affection between father and son is now palpable and enviable.",divorce,9,651
1113,"Fast forward 10 years. Students for Responsible Business is now called Net Impact . In 2004, I had the opportunity to attend their conference hosted by The University of Texas McCombs Business School. Net Impact had grown to include over 9,000 MBA students and alumni. Approximately 900 people attended the 2004 conference. The buzz words flying around the conference included social entrepreneurship, sustainable profitability, working with passion. I met student after student intent on harnessing the forces of business and capitalism to improve the world. These students understand that business is a powerful lever of change in this world.",conference,21,2006
1257,"Hi. I'm Christa Demore (ph) from Monrovia, Maryland. And I'm curious, how can Democrats claim that President Bush is ignoring the war on terror if al Qaeda's second key operative was just caught",caught,27,61
27,US diplomats have hinted in recent weeks that Washington's anger with European resistance to the campaign was focused more on Paris -- and to a lesser extent Berlin -- than it was with Moscow.,campaign,0,1047
338,"Last year's Bali bombings, which killed 202 people, illustrated the threat of terrorism in Indonesia. And, broad opposition to the U.S.-led attack on Iraq threatens to lead to a backlash by militant Islamists.",bombings,0,1289
118,"Well, no major concern. The Pentagon says that they do have air dominance as they now call it over the vast majority of the country that there are certain areas and only certain areas of downtown Iraq where battle management radars linked to surface to air missiles are still in tact. The reason that they're still in tact according to today's briefing was that they had not turned them on and as long as they don't turn them on, the U.S. has trouble locating them. They assure us that as soon as they do start turning on these radars that they'll take those out too and finish the job in terms of airspace over Baghdad.Judy ...",battle,0,131
1419,"all right. just about 25 minutes long in that press conference there at nato headquarters in brussels. he mentioned a headline a short time ago. u.s. forces moving in on the airports at saddam hussein international airport, 12 miles west of the city's center. colin powell saying an end will come soon and toward the end, this regime will be finished. also a question there about the united nations. a question about nato about what role these two organizations may play in rebuilding iraq. colin powell says the u.n. does have a role to play, what role that is remains to be seen. there was also one other moment there when you heard a woman asking about the safety of her husband right now. that woman, we believe s married to one of two journalists who disappeared in iraq almost two weeks ago, both work other for the network, itn. we have heard that perhaps both are being held in basra, possibly in a hospital, but there's no way for us to confirm their whereabouts, but obviously a lot of concern from this woman as to where whereabouts of her husband and his health. walt rogers is back with us. we've been in and out now for almost two hours. what's happening with you and the 7th cav as we continue to watch your image by way of video phone and the giant m1-a1 tank. walt, good evening again.",moving,32,411
367,"the, the situation, though, now that I'm out and, in the civilian sector,  um,  I find that the economics as far as home -- is what I'm most concerned with.  And because of the economic situation, I don't think that's being addressed.  Yes, I feel very, very bad in regards to the, ah, nine-eleven tragedy and terrorism and this kind of stuff",terrorism,0,853
688,"I've read that too - unfortunate, because I've worked with them in Rwanda and was very impressed with the professionalism of their organization. They also stated that there are lots of places in the world where they continue to work which needs plenty of help too - quite an important reminder because other needy areas of the world are getting less donations now. So they didn't discourage donations to them per se, just not for this specific area. Of course I realize that most people will want to help where the need for it is the most immediate.",donations,4,1603
239,"Counter-demonstrations in support of the US-led invasion of Iraq took place in some cities, with some 2,500 people turning out in Chicago. Flying the US flag and reciting the pledge of allegiance, they outnumbered their anti-war counterparts by three to one.",war,0,998
1034,Toefting has been convicted before. In 1999 he was given a 20-day suspended sentence for assaulting a fan who berated him for playing with German club Duisburg.,convicted,18,1256
808,Michelle Malkin has the goods on the March as well as links to other resources.,March,10,1824
404,"The Shias are a bit gun shy, if you will, in the south because of what happened in 1991. They rose up, didn't get American support. Do you suppose it will be a different story in Baghdad",what,0,178
941,"I believe any neutral management consultant worth his or her salt would recommend a merger of the two organizations. There is considerable duplication of effort and DBA is strong in one area--financial controls--where DMBE has consistently had problems. There would be service benefits to business clients, too. Nonetheless, the symbolism of having their ""own"" agency and support from Governor Warner for maintaining DMBE's ""independence"" apparently overcame any efficiency and service argument.",merger,16,1874
254,Putin will face re-election in March 2004 and analysts noted that the war -- while opposed by most Russians -- was never turned by the Kremlin into a matter of national security.,war,0,1051
329,"We will be back later on the war in Iraq. But first, we want to go somewhere else in the region to tell you that dozens were injured today in the first suicide bombing in Israel in three weeks. CNN's Kelly Wallace reports on today's attack in Netanya.",war,0,158
350,"I always tell people that the Georgia game matters more to me than the Bama game. I live in Georgia, and losing that game affects me much more directly than losing the Alabama game. That said, when kickoff time comes, you remember all the reasons that you hate Alabama and their dumbass haircuts and their detergent and toilet paper and their houndstooth hats and their ""Bear this"" and ""Bear that,"" and everything else that goes along with it. This isn't a football game, and it's not two drunken cousins fighting at a family reunion. This is brother against brother after one slept with the other's wife and then bragged about it. It's THAT serious.",fighting,0,1956
393,"Some 2,500 mainly university students formed a human chain in Japanese characters spelling out ""No War"" in Osaka on Sunday to protest against the ongoing US-led military campaign in Iraq.",campaign,0,1020
90,"trying to get mike hanna or jerusalem bureau chief, who was just on the air with us a matter of minutes ago. with the latest update on what was happening there and it appears in the time since we've talked to mike and also talked to professor about the peace process, evidence again that the resistance to any progress does continue. we are now hearing once again, this coming to us off associated press wires there was an explosion there and we understand that several people have been killed. again, this is what we're getting from the associated press. we're trying to get ahold of our reporters in jerusalem to give us the latest. and this being the latest in a series of what has become an almost customary tit for tat exchange of violent activity. last week, if you may recall, there was a strike on afraid in which a number of israeli soldiers killed, that executed by coordinated group of islamic jihad as well as al ak satisfy martyr brigades, and hamas all claiming responsibility for that and the strike ordered by sharon against the palestinian leadership going, targeting a top leader, mr. rantissi who escaped the helicopter rocket attack on his motorcade. however, two others who were there did die. this now, this happened over the weekend and then this morning,ware hearing it appear as though perhaps there has been another retaler to strike of some kind. we can't con foirm that is what happened. all we can tell you, there was an explosion on a bus in jerusalem in ventral -- central jerusalem. a number of people killed, perhaps several people being killed in the explosion, which happened just moments ago. once again, we're trying to get ahold of our mike hanna, who was just with us on the phone. i believe mike is over in jerusalem in the bureau working the telephones, trying to get as much information as he can and once behe gets something we'll deliver it to you. we'll take a break and when we come back, we'll pick up coverage of this development in jerusalem with mike hanna. how's that new analyst doing",explosion,0,603
885,"Getting out on parole is usually a reward for good behavior while serving time. So you're basically free, with the expectation that you will not leave the state (assuming you've been jailed by the state gov't) and you have to check in with your parole officer on a regular basis (I think they give you a schedule). I *believe* you are also expected to get a job, housing, etc. and report this also. In some cases you may be referred to a specific 'halfway' house for reintroduction into society, and provided with a simple job. As for how long it lasts, I would say that it lasts for the rest of your sentence, but I'm not sure about that. Also, you can call someone to come pick you up when you leave, or call a taxi I guess.",parole,14,1667
