,sentence,trigger,event_type,tag
940,"So it's over. I don't have Oracle/Peoplesoft's spat to kick around anymore. I'll have to stick with condemning the merger as a totally unworkable deal between two sides who absolutely hate each other. And I won't dwell on the irony of an Oracle employee being driven out of Oracle, starting his own company, and forcing Ellison to spend $10.3 billion to get his company -- but not him -- back (though it does rather delightfully remind me of Coca-Cola basically giving away the bottling franchise and then spending billions to buy it back). Ellison is brilliant enough to make this merger work, but he's crazy enough to wreck even the soundest of deals. We shall see.",merger,16,1987
508,...and the hmong sits and watch from the sideline while KIM II and BUSH jr. kill each other...Now wouldn;t that be a scene to view,kill,1,1739
333,"One group, Lesbians Against Boys Invading Anything, carried signs saying ""Pre-emptive war is terrorism,"" ""This isn't the USA I love,"" and ""Where Will the Bombs Fall Next",war,0,994
423,"I think it's Bind, Torture and Kill. Or something like that.",Torture,0,1661
931,"The secretary of state has written you a letter expressing, apparently, some concern about the length that the prisoners are going to be spending, those detained at the U.S. Naval base at Guantanamo Bay in Cuba, about 600 or so of them. Is there any movement in trying to determine the fate of these individuals",letter,15,298
1317,"Hand in hand with any consideration of the redistricting process, we shoul give some thought to the structural relationship between the state House and Senate. Currently, each House member represents approximately 75,000 Virginians, while each Senator represents appoximately 187,500. Often as not, there is no rational commonality between the two. Some senators represent people pools that are in turn fractured into five or six House districts. I believe this accounts, in large part, for the dysfunction that characterizes our state government now. Former Governor Gerald Baliles, in this same vein, has advocated a realignment of the two houses in a way that serves commonalities. He has suggested that we either increase membership in the Senate to 50, or decrease House membership to 80, producing a scenario wherein 1 Senator would represent a block of people who are represented by exactly 2 Delegates. He thinks--and I think he is right--that this arrangement would foster a closer working relationship between the Senate and the House. You certainly wouldn't have these dysfunctional groupings we now have, where 1 Senator often represents a population divided among half a dozen Delegates of two parties--three, if you count independents.",Former,31,1883
776,"i agree that the buyer probably didn't read the credit terms to find themselves with an unexpected rate... i always see that ""for qualified customers"" in all of their advertisements that probably releases them of any wrong doing... but i also believe in the court systems so let it take its course and see what happens. the only tort reform that i think should be done is to cap fees that lawyers are allowed to extract for class action suits. i feel that there is a valuable public service that comes from class actions suits which is to keep companies on the straight and narrow so that they avoid such actions... but from a monetary perspective the only real winners from class actions are the lawyers. i remember once receiving a fifty cent check in an envelope with postage of at least half that amount for the great 17"" monitor class action suit.",suits,8,1589
870,"You never EVER show up at court, especially facing indictment for stealing large sums of money, wearing a fucking FUR COAT",indictment,13,1952
1197,"Five Palestinian children, a Palestinian woman and a police officer, were injured Tuesday after accidentally detonating explosives in the West Bank city of Hebron, Palestinian security officials said. The children found the explosives in two plastic bags under a tree and accidentally detonated the first bag. After a police officer arrived, the second bag exploded, seriously injuring him, the officials said.",injured,24,1425
1403,"Dominating the city gates to Basra. Saddam Hussein and his henchmen still claim to control this southern port. But the British want to send a powerful symbolic message. Soldiers are here to tear down the regime and all it stands for. By the time they leave Iraq, they're determined Saddam and his Ba'ath Party will have bitten the dust. The approach can seem frustratingly slow, but day by day, the Desert Rats are exerting more control. Checkpoints meant to filter out Iraqi hardliners. (on camera): They're well within striking distance of the mortars and rockets of the Fedayeen militia, but they're prepared to take that risk to try and persuade the people of Basra that they won't desert them, that they'll stick with this however messy it gets. (voice-over): Drastic action is need to convince a dubious population.",leave,32,224
789,"Divorce *is* really stupid. Duh-uh. Especially for those of us who still have so many years (if one year for every 2 married, then I've still got another 7 or so) to go to get our heads screwed back on and find some sort of life that rivals what we had or what our ex has or what you and your ex have. So far, this is not it. -- Barbara Sz.",Divorce,9,1587
1325,"reporter: for the first time since being cut from the team in high school, michael jordan was left in the awkward position of being unwanted by the game he has come to define. after playing the last two seasons with the washington wizards, jordan said he expected to return to the front office. instead, during a meeting that lasted only minutes, team owner told jordan his services were no longer necessary. jordan issued a statement expressing his shock over",cut,31,523
1029,"The ``godfather'' of organized crime, Truong Van Cam  _  better known as Nam Cam  _  was convicted of seven crimes, including murder. He was sentenced to face a firing squad, and his lawyer has said he also plans to appeal.",convicted,18,1456
575,"the story of a woman in an east texas jail cell tonight. we're told sometimes she sits in the fetal position, other times singing gospel music. occasionally she'll pray, sometimes cries hysterically. her name is deanna lejeune laney. she's accused of beating two of her three children to death because, she says, god told her to. now that happened this saturday. today the wheels of justice began turning. katherine garcia of wfaa joins from us the smith county courthouse in tyler, texas.",death,1,529
197,"Thanks very much. Judy, dangerous assignment for all of our reporters, our embedded journalists. And one of them, not from our CNN, but from a very close friend of all of ours, Michael Kelly, paid that price. The first American embedded journalist to have gotten killed in covering this war. We'll have more on him at 5:00 on our special edition of ""WOLF BLITZER REPORTS."" Until then, thanks, Judy, back to you.",war,0,222
1135,"""The day the Nazis came to the hospital, someone came to our room and said: 'You have to cough, you have to cough a lot because they are afraid of the coughing, they don't want to catch an awful disease and they won't enter'.""",came,21,1797
1576,"The situation here appears to be increasingly tense. A few moments ago, out on the horizon, not very far ahead of the U.S. Army's 3rd Squadron, 7th Cavalry, we heard more than a few explosions. The U.S. Army's 3rd Squadron, 7th Cavalry has compiled a rather extraordinary record in the past several days. It was the first unit to cross the Euphrates River and then punch northward to within 60 miles of Baghdad. It was the Army which assigned me to the 3rd Squadron, 7th Cavalry, and that was extremely fortuitous. It was like sitting in a poker game and drawing four aces, because this is a crack unit. It's the tip of the tip of the spear. We've had an absolutely terrific story, pushing forward north toward Baghdad. Seventy-two hours of that was under constant fire coming at us from both sides of the road.",cross,32,155
757,"The deadlock, and subsequent lack of any films, has been threatening to de-rail the debut of easyCinema's first outlet in Milton Keynes, just north of London, which is due to open its doors on May 23.",debut,6,1099
52,"Echoing Blair, Bush said the UN would play a role in all aspects of post-war Iraq, from humanitarian aid to a future interim authority, adding that Iraq would ""move as quickly as possible"" to an interim authority made up of Iraqis from inside and outside the country.",war,0,1518
446,5. Death of Arafat (1) Controversial PLO leader Yasser Arafat died in a Paris hospital last week.  Do you think Arafat's death will help or hurt the Israeli-Palestinian peace process,Death,1,823
1109,The proposed draft resolution would probably face resistance from other U.N. Security Council members who have favored a U.N.-convened conference of the kind that helped establish Afghanistan's post-Taliban government.,conference,21,1366
842,"I have 2 girls already, nearly 8 and 4.5 yrs and I have always said I will NEVER forget the pain of childbirth. Abby was a true water birth (3kg - normal) and with Fiona I was dragged out of the pool after the head crowned (gyno had written on my notes she was 4kg (large) and that she was not to be born in the water (long painful story",childbirth,11,1626
456,"talking about the sars threat worldwide this morning. the world health organization says there are 4200 sars cases so far, more than 250 deaths in 27 countries and there is no cure. and nobody knows what is causing it. the question is, would you change your plans because of the threat of sars",deaths,1,461
317,"It had been very quiet inside Israel since the start of the U.s.-led war against Iraq. Many Israelis were fearing that quiet would come to an end. And it did on this day. Police say a suicide bomber blew himself up outside this cafe, called The London Cafe, earlier Sunday afternoon. We can show you some pictures from earlier Sunday. People here tell us the cafe was filled with people enjoying the spring weather. Many here though say they are relieved only one person dead, the suicide bomber. Dozens, though, injured, including some Israeli soldiers, because according to an eyewitness, he said many soldiers were here also enjoying the spring weather.",war,0,159
472,What do you think of Israel's policies surrounding Arafat's illness and death,death,1,895
53,"Saddam was so unimpressed by Iraqi casualties, he invaded Kuwait barely two years after the UN-imposed ceasefire.",invaded,0,1753
282,"well, the fbi can drain the pacific ocean but they won't find any evidence that he was involved with the attacks because he had nothing to do with the anthrax attacks at all.",attacks,0,527
918,"They wait for hours to find a journalist and they plead with us to borrow our mobile satellite phones. They need to send a message to their families abroad just to tell them, ""We are alive,"" says this woman. Here, they wait outside a restaurant where journalists hang out. And they are desperate. ""Only for one minute,"" says this mother. She wants to call her pregnant daughter Saba (ph) in Sweden to see if she has delivered. ""It's not good for her to worry about us,"" she says. Across the fence, a 21-year-old U.S. Marine named Jason Cook (ph) is after the same phones. He wants to call his mom in Houston. A ""New York Times"" reporter lends Cook his mobile sat phone.",call,15,289
1178,"Former Danish international Stig Toefting dropped his appeal of an assault conviction and will serve a four-month jail sentence, Denmark's TV2 reported Monday.",sentence,22,1250
1434,"A U.S. military official in Seoul, speaking on condition of anonymity, said Tuesday North Korea is believed to have exported US$580 million worth of missiles to Iran, Pakistan, Libya, Syria, Egypt, Yemen and the United Arab Emirates in 2001.",exported,32,1392
1443,"It's -- yes, it's extremely dangerous, because once you enter these buildings, we found, actually, enemy, you know, guarding these sites. Don't know if they're going to be booby trapped. Don't know what -- what's going to be there. So it's very tedious, it's -- got to be careful about it.",enter,32,241
39,"No, it's so important -- you know this -- and I know it's fun and we love doing partisan Punch & Judy, but is there ever a time when we stand up even if we respectfully disagree with the commander in chief and those who would wage war",war,0,53
1124,"Weldon said at a news conference in Seoul that North Korean Vice Foreign Minister Kim Kye Gwan repeated that claim during a dinner meeting. Both Kim and Foreign Minister Paek Nam Sun told Weldon that Pyongyang planned to produce more nuclear weapons and had nearly finished reprocessing the spent nuclear fuel rods needed to do so, despite pressure from the United States and its allies.",meeting,21,1438
1069,Campbell was not in court. Lawyer Steven Barta said his client had already completed the required programs in Canada. He also brought a check from Campbell to pay the fines and fees.,fines,20,1225
949,"If the Sunni's were prevented, or restricted or otherwise not allowed to vote, then they could claim illegitimacy, but since the simply just collectively decided not to vote, then they declared the vote legitimate of their own volition whilest simultaneously ceding power to all non-Sunnis.",vote,17,1730
294,"Other units moved into airfield complexes in western Iraq believed to have Scud missiles capable of reaching Israel, and possibly weapons of mass destruction.",reaching,0,1212
1376,Czech President Vaclav Klaus on Monday appointed Miroslav Kostelka as the country's new defense minister to replace Jaroslav Tvrdik who resigned from the post in late May.,resigned,31,1539
1438,"Oh yeah and what's going on in, I know and people -- flock, flock to the store to buy all their -- all their foreign made goods and it's like what are you -- doing",flock,32,792
355,"The result was that the information dried up and the genocide took place. Yup, good ole Kofi told this poor guy to give the secret info over to the very government that was planning the genocide. What a great guy he is isn't he.",genocide,0,1925
555,"Singapore has reported 16 deaths, the world's third-highest toll, out of 186 infected from the flu-like illness. Globally, at least 236 people have died and more than 4,000 have become sickened with the illness.",deaths,1,1351
7,"james was not shooting and he was not with somebody shooting. so, again, to know exactly what happened we need a full-fledged inquiry.",shooting,0,502
185,the associated press is reporting that u.s. troops have launched an attack on saddam international airport. about nine miles from the iraqi capital. pentagon officials briefed reporters who refused to comment about any activity at the airport. officials say they'll make comments after certain operations are conducted. but not before.,attack,0,322
77,blast at an Iran nuclear facility Iran blames US US breaking news of terrorist attack in near future sounds like some heavy war rhetoric to me.,attack,0,1696
288,"yeah, they're- where they're coming home from the war and they -- yeah, they're- they're pretty much homeless and- and ha- they have nothing.",war,0,927
972,Sunni say the poll is now illegitimate because they chose not to vote.,poll,17,1729
1316,"Back in 1996, budget cuts eliminated the job of State Archaeologist. Now, according to the Virginian-Pilot , the job is about to come back via HB 2078 . With all this surplus floating around and the Jamestown 2007 celebration coming up, who wants the state to be shorthanded in archaeology",eliminated,31,1884
801,"The city assigned 2,000 police officers to the rally, including undercover officers who carried beeper-sized radiation detectors and other counter-terrorism equipment.",rally,10,987
632,"If you were president, which national figures would you appoint to your cabinet and why",appoint,3,721
946,"Here on the left edge of the country, we have a unique perspective on election standards.",election,17,1672
911,"This time, they hope the sailors will write back with answers to their questions.",write,15,275
1278,"as we told you at the top of this newscast, an oklahoma judge has ruled that terry nichols will indeed stand trial in that state court on 160 counts of first-degree murder. the oklahoma city bombing conspirator is already serving a life term in federal prison. state proceedings could bring the death penalty if nichols is convicted. a trial date was not immediately set by the judge whose decision came as prosecutes were still presenting evidence. a texas woman is in jail this morning accused of killing her two sons and severely beating another the day before mother's day. yesterday a silent dee ana laney waited as the judge read the charges against her. capital murder and aggravated assault. one of the first people to arrive at the crime scene. judge james marin. thanks very much. why were you there so quickly",trial,29,532
229,"Mr. King, thanks for stying with us through the break. One of the reasons that we like having you on, and as well as Mr. Rangel, is that, you know, this is war, as we were saying in the last segment. You treat it with the gravity and the seriousness that it deserves. And you're a congressman who has put his constituents and his country ahead of his partisan interests. So I wonder if you'll join Charlie Rangel, who put out a press release today, decrying the Republican attempt to hijack a bill to help our servicemen to use it to give special interest tax breaks to corporations. Isn't that wrong in a time of war",war,0,81
1432,"Well, we'll debate that later on in the show. We'll have a couple of experts come out, so I'll withhold my comments until then. Even as the secretary of homeland security was putting his people on high alert last month, a 30-foot Cuban patrol boat with four heavily armed men landed on American shores, utterly undetected by the Coast Guard Secretary Ridge now leads. Now, why has our president placed homeland security in the hands of Republican political hacks instead of professionals, by the way",landed,32,0
503,"and the growing number of sars cases in china. the country reported now 160 new cases and nine more deaths. there are no signs that this infection rate has grown. beijing remains the most affected part of the country, but figures show this disease is also spreading in northern china. 11:00 a.m. on the east coast, 8:00 a.m. on the west. leon harris checking in here. up first, searching for survivors. from deadly tornadoes in the midwest and the south. the path of destruction scratches through kansas, missouri, arkansas and tennessee. cameras captured a tornado on the ground in missouri. the governor has declared a state of emergency after twisters struck several western counties. 20 people were killed in that state. in kansas, authorities say seven people were killed when tornadoes cut across the southeastern part of the state. several counties have been declared disaster areas there. now, across the region, the storms demolished homes, ripped down power lines, uprooted trees trees. search teams looking for people who are still missing. one of the sites proving to be the most deadly was the law enforcement center in the western tennessee city of jackson. an emergency official tells cnn that ten people died there. dozens were hurt. joining us on the phone is the mayor of jackson, tennessee, charles farmer. mayor farmer, can you give us the latest on your town.",deaths,1,497
371,"reporter: investigators involved this case clearly frustrated. 18 months later, still not one single arrest for those attacks that killed five people and sickened 13 others. lou",attacks,0,528
86,"Paul, look, the problem is I would stipulate all four of us hates war. Any rational person hates war. Bush isn't sitting in that White House not thinking about the body bags coming home with great young men. Clinton suffered greatly over the 19 Rangers that died, 18 on the 3rd of October and Matt Reersen (ph) three days later. I visited all their families. I was at the medal of honor ceremony for the kids. Let me tell you, what trips to Walter Reed taught me was, that whoever thought up the term, the law of unintended consequences it pertains to war. I am shook over the aftermath. But, this guy is a monster, a mini-me Hitler. He will blow a city off the earth in a minute if he can get the hold of the means to do it.",war,0,11
844,"Here are some of the fine achievements of the terrorist Marwan Barghouti Marwan Barghouti (born June 6, 1958) is a Palestinian leader from the West Bank and a leader of the Fatah movement that forms the backbone of the Palestinian Authority and the Palestine Liberation Organization (PLO). On June 6, 2004, he was sentenced to five life sentences for five murders of Israeli civilians and 40 years imprisonment for attempted murders in terrorist attacks against Israeli civilians. Barghouti was one of the major leaders of the First Intifada in 1987, leading Palestinians in a mass uprising against Israeli occupation of the West Bank. During the uprising, he was arrested by Israel and deported to Jordan, where he stayed for seven years until he was permitted to return under the terms of the Oslo Accords in 1994. In 1996, he was elected to the Palestinian Legislative Council, in which he advocated peace with Israel, sometimes coming in conflict with Yasser Arafat. The formal position occupied by Barghouti was the General Secretary of Fatah in the West Bank.",born,11,1898
479,"On a less-sarcastic note, I pray for the family of the 23-year-old woman. No one should have to die because some crazy nut wanted a child and decided to kill for it. If there's any good news in this story, it's that Victoria Jo will live on and carry her mother's memory. Question for the pro-choicers: Being that it isn't yet the ninth month, can we still charge the killer with kidnapping",die,1,1808
1258,"From the Associated Press : A baby girl who had been cut out of her mother's womb was found after a frantic search, and authorities arrested the woman they say strangled the mother and stole the child. The baby was in good condition Saturday.",arrested,27,1803
162,"Congressman Rangel, a couple of months ago Senator Daschle on CBS said -- made the charge that we are, quote, ""we haven't made any real progress in the war against al Qaeda."" A lot of Democrats said similar things. This weekend Khalid Shaikh Mohammed, the No. 2 member of al Qaeda and another significant al Qaeda member were captured in Rawalpindi, Pakistan. Doesn't it turn out that Mr. Daschle and others didn't know what they were talking about and maybe they shouldn't make charges like that in public when they don't know what they were talking about",war,0,82
167,"Passions ran deep on both sides, but a line of police in riot gear kept them apart. Carrying signs that said, ""It's the oil, stupid,"" and ""Real men don't bomb children,"" the anti-war protesters waved blue Earth flags.",war,0,999
397,"Organizers of the civil disobedience campaigns promised to block intersections and bridges, shackle themselves to lampposts and create human cordons to snarl traffic, as long as the war continues.",war,0,1006
1064,"This line of reasoning seems to derive from arguments that Japan was being ""driven into a corner"" by sanctions, and had no choice but to attack the US. Meiji Japan was driven to emulate what it thought the West was doing in every facet of society. They had observed, for example, that the West was able to carve up China into ""Spheres of Influence"", and was able to do from great distances, while they, the Japanese, had had limited success in their previous attempts to dominate the Korean peninsula, much less China. As part of the catch-up effort, she whole-heartedly entered into the Imperialist game in Asia, being treated as an equal (relative to her power) by the other powers. However, after World War I, Japan failed to recognize a fundamental shift in the attitudes of her former Imperial partners; they began a long, slow process of disengaging themselves from their former Imperial areas, from their colonies, in addition to outright stopping all expansions. Japan chose to read this as a sign that the West had lost its power and resolve, and that Japan was the rightful heir to Imperial mantle in Asia. With the deaths of many of the idealistic leaders who had led Japan's rise to international prominence, and the refusal of the US to intervene in Asian affairs, in addition to the Bolshevik revolution and the stripping of possessions from Germany, Britain found herself alone in dealing with an increasingly aggressive Japan in the area. Having a keen grasp of the obvious, she began a policy of acceding to Japanese hegemony in the area.",stripping,20,1760
1252,"Earlier this week, security police detained the Monitor's managing editor, Nhial Bol, for 24 hours. On his release, he was charged with incitement of public discord for publishing the letters.",detained,27,1386
995,"What if Chichester had been elected Lt. Gov, instead of Wilder, all those years ago",elected,17,1882
