,sentence,trigger,event_type,tag
35,"When you're on the ground fighting, every piece of information you've got about what you're coming up against is golden.",fighting,0,246
549,"In 1991, however, the U.S. Congress banned this after Indonesian troops killed hundreds of civilians in East Timor.",killed,1,1293
1283,What's the most memorable criminal trial you can recall,trial,29,837
211,"War may sometimes be a necessary thing, but it can never be a natural thing. Training bridges that gap. Sergeant Chuck Hagel was seriously wounded twice in Vietnam.",War,0,109
377,"From the south to the north in the rolling hills of northern Iraq, coalition air strikes targeted Iraqi positions today in what's been called a ferocious bombardment. It happened outside the oil-rich city of Kirkuk. CNN's Brent Sadler is there.",bombardment,0,185
1096,"Secretary of State Colin Powell said the offer was made during three-way talks between US, North Korean and Chinese diplomats last week in Beijing.",talks,21,1074
557,"reporter: it was the lead story across connecticut in early april, police say jennifer o'conner, a connecticut woman with a history of psychiatric problems confessed to shooting her daughter 7, while the 7 -year-old girl lay sleeping. o'conner told police she could no longer cope with her daughter daughter's learning, disability prps sara dade three days later. thomas, owner a local gun and motorcycle shop, said he felt gutted when he saw the news reports of o'conner's vest on murder charges.",shooting,1,516
1311,"Blasphemy is punishable by death under the Pakistan Penal Code. However, no blasphemy convict has ever been executed in the country.",death,30,1073
1501,"reporter: and this is a military town, judy and little by little we are seeing these soldiers head out. in a strange way and this may sound unusual, there's a little sense of relief because these soldiers were set to leave in january and now they got second deployment orders, the delay, of course, the inability to get access to turkey, but along the way, the 4th infantry division is one seeped in tradition and there's a real sense of pride among the soldiers, 250 of which left yesterday, over the course of the week 12,000 will be leaving from here. another 4,000 from fort carson in colorado and it dates back to world war i. their equipment that left on january is now on a ship on its way south through the suez canal and it's interesting to note some of the equipment that's been held up for the last couple of months, there are some 5 helicopters, 200 tanks as well as 150 bradley infantry fighting vehicles. these are highly trained soldiers. they are ready to go. they are happy to be finally able to come and back up the first wave of troops that left from here. their mission is very broad, judy to deploy anywhere in the world in support of national strategy. they doan know what they'll be doing. they will learn that once they get there their first stop will be to central command, they'll receive more specific orders. they will be join by the first cavalry. they have received deployment orders. they have not yet been told to make final arrangements. they all tell me, the soldiers you talk to and also some of the information people here at fort hood, they train like they fight. they are ready. they are determined and they are very patriotic in support of our country. they are going over there to do a mission they believe in and as we said, 250 left yesterday. they were armedded with their m-16s, they are concerned. their families were here to see them off, but they are determined to return though it is interesting to note that many of them, so many with young children have told their kids that mom or dad could be away for as long as a year. judy",head out,32,392
57,"much -- Yeah.  So, I mean, i- -- you know,  uh, how we consider -- Arafat a terrorist,  we also should consider that -- could've been, in some ways, a reaction to some of the terrorism that was -- initially -- committed by the Israelis.",terrorism,0,890
1218,"Grigory Pasko's lawyer Genri Reznik filed the appeal with Russian Supreme Court, the Interfax and ITAR-Tass news agencies reported. He asked the court to invalidate the verdict and throw out the criminal case against Pasko, they said.",appeal,25,1301
562,"More than a few e-mails have come in wondering why I haven't remarked on the horrible hunting tragedy on Nov. 21 that left six people dead, and why I haven't updated the ASSAULT WEAPONS BAN COUNTER.",dead,1,1792
360,"It means when you take the threat of force of the table, you're likely to stop disarming Saddam Hussein.",force,0,70
1245,We had no part in it.,it,27,63
132,"Again, we know where we're going. We know where they're at so we simply avoid them and if for some reason they do get off a lucky shot or they do see us, we have defensive systems on board the airplane to defeat their ammunition.",defeat,0,118
82,"24 hours after a coordinated series of suicide bombings in saudi arabia, the death toll is still rising. an eighth american has died. in all, 21 people were killed, not including the nine suspected bombers. nearly 200 people were injured. u.s. and saudi officials say the bombings bear the trademark of al qaeda. they may have been timed to coincide with the arrival of secretary of state colin powell in riyadh. the state department is ordering all non-essential diplomats and dependents out of the country. an fbi team is heading to saudi arabia to help investigate the attacks. they targeted three residential compounds for americans and other westerners.",bombings,0,336
916,Her second-graders were very interested in sending some letters out to the troops.,letters,15,270
759,"No. Well, what we've heard the numbers of reconstruction running around $100 billion. We put $2.5 billion in, in the last supplemental appropriations bill. So it's going to be costly. These RFPs, these seeking bids on various contracts are rather costly, and so it's going to be expensive. And clearly the responsibility is going to fall principally on the United States. Now, I would hope that sooner rather than later we could see a civilian government emerge in Iraq, a democratically elected one, that there'd be more cooperation from the international community, on both the peacekeeping side as well as the political restructuring that's necessary in Iraq. And to the extent we can move that along more quickly, I think we're all going to be better off. Being the sole, or almost the sole power there, both in terms of reconstruction and politically, exposes us to great vulnerabilities.",emerge,6,309
450,Allied successes were marred by the collision of two Royal Navy helicopters over the Persian Gulf in which all six British crew members and one American were killed.,killed,1,1207
547,"the israeli government said its forces were returning fire and that miller was shot in the back, suggesting he could have been hit by palestinian gunmen. those close to miller believe he was shot by an armored israeli personnel carrier. we know the israelis fired. whether or not he was shot by israelis gunfire, we are not certain at this time. miller becomes the second journalist in just two weeks to be killed covering the israeli-palestinian conflict. with palestinian cameramen, shot and killed by an israeli soldier on the west bank in mid-april. with back-to-back deaths making a total of at least seven journalists killed covering the conflict in the past two and a half years.",deaths,1,503
983,"Yeah, I guess the elections, ah -- basically, who did you vote for, and the vice presidential candidates, and why, and I'll be honest with you",elections,17,848
1128,But officials in Seoul said Sunday that North Korea had yet to confirm that Cabinet-level meetings scheduled to begin Monday in Pyongyang would go ahead. Seoul had hoped to use the three-day talks to try to persuade its communist neighbor to scrap its suspected nuclear program in return for aid and better relations with the outside world.,talks,21,1270
1000,"She would be my s- -- well you know what, actually, I liked Dean a lot I must say, in this election. And I think it was just",election,17,681
305,that's what we're doing as we come through here and completely search theses have else to make sure there's no one lurking on there with weapons or rpgs or some other pad to take down helos that are flying by or any other ships that are coming in through here.,take down,0,319
283,"The Americans say they've destroyed two divisions of the elite Republican Guard. (on camera): The Medina division, which is one of the toughest outfits in the Republican Guard is now down to 10 percent of its fighting strength. That means it's practically inoperative. Others are down to 50 percent, but there's still one or two divisions around 75, 80, 90 percent of their fighting strength, and they could still put up very stiff resistance, indeed, when the American forces get en masse to Baghdad itself. (voice-over): The noose appears to be tightening on Saddam Hussein. The question is, how desperate he will get before he is finally toppled. Carl Dinnon, ITV News, Iraq.",destroyed,0,200
366,The call reflected the insistent demand made by the three leaders before the US-British invasion of Iraq that UN approval was essential for any mission to topple Iraqi President Saddam Hussein.,invasion,0,1030
1099,"well, security is tight as exxon mobil shareholders meet today in dallas. allan chernoff live from the new york stock exchange to tell us what's behind the precautions.",meet,21,560
763,"The Daily Planet Ltd, about to become the first brothel to list on the Australian Stock Exchange, plans to follow up its May Day launching by opening a ""sex Disneyland"" here, the Melbourne-based bordello announced Wednesday.",launching,6,1085
978,"Cool.  Um, man I thought I, uh,  put this whole election stuff behind me.",election,17,855
1469,"Royal Marine commandos carried out an overnight sweep around the port, searching for Iraqi holdouts. The British said they had enough control over the area to begin sending in ships.",sending,32,1242
1468,"Friday, July 8th - Drive back to Boston passing through New York -- do whatever -- 262 Miles from Red Banks to Boston but add whatever miles from New York - Stay the night with friends in Boston",Drive,32,1713
656,Making this list is certainly a source of pride. It can also be helpful if you are looking for a nice new job. Should anyone else pay attention to this list,new,3,2012
1165,"Indonesian courts have increasingly handed out severe sentences, including death, for drug smugglers. Narcotics abuse is an increasingly serious problem in the country.",sentences,22,1015
146,an air force pilot is back at his base after a close call. military officials say a missile hit his warthog and he was forced to eject. cnn's gary tuchman is live near the iraqi border with details on the mission and the pilot's rescue. gary,hit,0,424
1315,"the central command on the other hand says rivera is being kicked out of iraq because ""he gave away the big picture stuff."" all of this now under review, whether or not geraldo stays or goes. we'll continue to monitor that front on the store yix another veteran war correspondent is being fired for his controversial conduct in iraq. nbc is terminating freelancer reporter peter arnett for statements he made to the iraqi media. we showed you the statements yesterday. he said the coalition's first war plan had failed because of iraqi resistance. today he appeared on on nbc's ""today"" show and said he was sorry.",fired,31,398
266,"All right. We're paying attention to all those details for us, Chris Plante at the Pentagon. You're looking at live pictures of Baghdad where there have been more strikes, more bombs dropped, more missiles this evening and of course as always, CNN keeping a close eye, a close watch, a close listen on what's going on in Baghdad. Coming up, coalition forces control several parts of southern Iraq but they still face some serious problems including pockets of resistance. That story when we come back. Since marching into Iraq, coalition troops have engaged in some fierce battles with Saddam Hussein's forces. A serious problem they still face though, pockets of resistance. Reporter David Bowden is with the British forces in Umm Qasr in southern Iraq.",strikes,0,132
414,"A furious Justice party member, Fehmi Husrev Kutlu, rushed toward Ozkan, bumping into him and sending his eyeglasses flying, Anatolia reported. Other legislators surrounded the two to head off a brawl.",brawl,0,1190
17,"Yeah, I- I agree also. Yeah, I- I mean, I- I did support the war. I just think that when they went in there, you know they -- they just didn't -- you know, they didn't i- execute everything correctly, you know there was problems, you know.",war,0,958
30,"Hello, everybody. Welcome to CROSSFIRE. On this Ash Wednesday, the pope asks Catholics to fast for peace and he asks President Bush to work for peace, while the White House sends out Colin Powell to make yet another case for war. We will debate all of that as well as ""Vanity Fair""'s latest, stunning revelations about Michael Jackson. Believe it or not, we got new news on Michael Jackson. Do you think he really looks like a mummy",war,0,66
1186,"Anwar was told Monday that he had been granted a standard one-third remission of a six-year corruption sentence for good behaviour, and immediately began to serve the nine-year sentence for sodomy.",sentence,22,1059
289,"The gunman began shooting inside the Hudson Valley Mall shortly after 3 p.m. in Kingston, nearly 90 miles north of New York City.",shooting,0,1834
1460,"Yeah, that's what we do.  Every year,  uh, but I don't always attend. Uh, my family -- celebrates the sun shining. They're always together. So, uh, it's not particularly special at Christmas -- because they see each other every other weekend.  But, still,  uh, they go to, uh, grandmother's -- every Christmas.  A particular person's house every holiday season.  You know, whether it's Christmas or -- Thanksgiving or Mother's Day or Easter,  it just alternates it- you know, each- uh, a particular person's house is- is how they do it.",go,32,903
1322,"gone.  Yeah, that guy Bernard, uh, the guy that was New York mayor. Or, not the mayor the New York police department chief or whatever. Eh, he quit, or he resigned. Something about,  um,  he had a legal maze or something.  Yeah, it's all -- you know, I I I don't know if we're doing the right thing because now look at Iran, what are we going to be, uh,  and he he's talking about trying to invade Iran now.",resigned,31,944
1121,Indonesia's Foreign Ministry spokesman Marty Natalegawa says Megawati's meeting with Russian President Putin slated for April 21 will touch on the Iraq crisis.,meeting,21,1287
642,"Tvrdik, who took over the defense ministry in May 2001, also announced that he would quit his post in the parliament and give up his position in the ruling party Social Democrats.",took over,3,1542
686,"Th- that was the Bank's big deal last year, was uh ninety percent associate satisfaction.  And they were all happy when they finally got there.  But we didn't get anything for it.  They didn't like give everybody bonuses or anything.  Sheesh.  They because they got some better insurance policies and some better -- bonuses that they paid out at the end of the month and -- you know, it was a little better.",paid out,4,705
853,"Naxakis and two of Ocalan's Kurdish associates are being tried on criminal charges of endangering national security. Ocalan, being tried in absentia, was indicted for entering the country illegally, a misdemeanor.",charges,13,1471
322,"No, we have full credibility in Iraq. We've prosecuted with the alliance a successful liberation of the Iraqi people, and we have clearly caused Saddam to destroy weapons of mass destruction, or at least to suppress evidence of them. That is a victory of sorts.This is a facet that's important. It's important in the war against terrorism that we rout out whatever is there and, likewise, the people involved, because they might help supply al Qaeda or other terrorists along the trail.",war,0,307
600,"Apparently Yuganskneftegaz, which was sold to an independent buyer who turned out to be an apparatus of the state (yes, the same state that 1) forced Yukos to do the auction, and 2) ran the auction, not that 3) this is suspicious or anything), and which was then being bought with foreign assistance, is not being bought with foreign assistance. As of this morning, at least. Anyway, it looks like they're denying Chinese involvement to avoid a lawsuit , which is funny -- you'd think they might know someone in the Russian judiciary who could help them out.",sold,2,1996
454,Basson was accused of directing South Africa's former apartheid regime's biochemical efforts aimed at destroying its opponents.,destroying,1,1448
902,"reporter: hello, judy. during a brief phone call with their son from kuwait on surngd the arm asked the young family not to get into any specific details about what happened during their son's capture and release. however, the family did get in a company of questions about how he was treated. they learned he lost 20 pound pounds and also their son told them that in the last few days of his capture, things weren't so bad but that they were very rough in the beginning. now they are learning more details that their son in fact was kicked and beaten after his capture, and that his fellow pilot david williams had a knife held to his throat immediately after an tur, according to an interview their son was allowed to conduct with ""the washington post"", who flew with him into kuwait. their son is said to be in very good spirits now and back here in georgia, after three weeks of not knowing exactly what had happened to him, finally, for the very first time in three weeks, the young family members got some sleep last night for the first time in a long time. well, at least some family members did.",call,15,432
1544,"also ahead, the anatomy of a rescue, just a couple of hours ago, rescued p.o.w. jessica lynch arrived at the ramstein air base in germany for medical treatment. a little later we'll speak with her family and talk a closer look at the daring operation that produced her safe recovery, but first the push into baghdad. coalition field commanders say u.s. troops are now within 15 miles of the iraqi capital. they say their forces today with the iraqi republican guard units as part of a protwo-pronged advance on the city. u.s. troops could be in baghdad southern outskirts by early thursday. however, the pentagon is down playing the idea that an invasion of baghdad is imminent. for the second straight day, iraqi television meanwhile has broadcast a statement from the iraqi president saddam hussein. however, despite the appearance of saddam hussein in and what was said to be new fattage, the statement itself was read by an iraqi news anchor wearing a military uniform. u.s. officials say they aren't sure whether the iraqi president is still alive. regardless, the statement praised iraqis who have fought coalition forces. it was said to be saddam hussein's response to a letter from his niece.",push,32,405
144,"Let me tell you. They have it and we supported them having it when they were fighting Iran so it's no big deal there. And the thing is that if we can disarm them without actually going there, killing them, I really think that we maintain our moral authority around the world. We have a lot of people...",fighting,0,88
610,"This is Talil, Iraq. The Talil Air Base. But the are no more Iraqis here, the coalition took over this base last week. It's now a major staging point. You know you are in Iraq when you drive down the road coming into the base and see the portrait of Saddam Hussein. What's happen is the military personnel who have arrived here have taken out their markers and are writing messages on Saddam Hussein's portrait. You can see the main one here on the bottom and also here messages like, we won, April 1, 2003. Want to give you a look. There's a lot of security personnel here. You can look over there and you can see the military vehicles. These are Air Force Security Forces with their rifles patrolling the entrance. There is a lot of fighting in this area. We're near the town of Nasiriya. But this base now is considered secure enough to make it a major staging point for the coalition.",took over,2,190
407,"reporter: well, first of all, regarding the rape, they hope to find out who the father is once she gives birth because they will analyze dna from the baby in order to try to determine paternity in this case. and the governor has ordered a panel of experts now to study this issue of security, far better security than is clearly needed for people such as this woman, jds, living in group homes.",rape,0,669
746,"Webb also said details of the breakdowns of the Welches' previous marriages were likely to come up, and cited reports of alleged extramarital affairs by both.",marriages,5,1234
169,"This Isn't Writing, It's Typing has a great post out with a ton of info, some of it quite scary A more frightening scenario is that terrorists may have obtained a Chinese-produced ZM-87 laser blinder which is specifically designed to blind eyesight. The Japanese terrorist cult Aum Shinrikyo--which launched the infamous Sarin gas attack on the Tokyo subway system in 1995--was discovered to have experimented with the use of lasers as weapons.According to The Asian Pacific Post, ""Cult members apparently obtained laser design information from Russian institutes they visited and built a laser weapon mounted on a truck. They had planned to use the laser against Tokyo policemen, but the plan failed when the laser malfunctioned during the testing stage."" PoliticAlex also has some info on this story also.",attack,0,1913
738,"That's sad, Lee. I really think it's time for the church to admit that a civil ceremony followed by a temple sealing reaches the same goal, often in a more loving way, than insisting that only the sealing is worth doing. A change of that sort would be very simple to implement, and most church members would like it better than allowing non-LDS family members into the temple, which would actually be my preference.",ceremony,5,1571
406,2Slick pointed me to a article at In Iraq For 365 . This is a great blog and I encourage you all to read it regularly. On Sunday he wrote of two Iraqi soldiers who didn't see us as conquerors but as allies when the Mosul bombing occurred. The suicide bomb sprayed bb-like fragments throughout the Marez dining facility. One piece of shrapnel sliced through the femoral artery of a U.S. soldier and his only chance for survival was in the hands of these two Iraqis.,bombing,0,1902
1476,Palestinians and their dovish Israeli allies routinely use the word ``occupation'' when demanding that Israel leave the West Bank and Gaza and dismantle Jewish settlements.,leave,32,1431
1597,"In the case of 1991, the task was to go in and get them out of Kuwait, and they did it, and they were properly greeted coming back to the United States. In this instance, it was a very different task. It was to remove that regime, and it's part of a global war on terrorism that is not over. We still have to face the problem of a number of global terrorist networks and terrorist states that exist, that work with those global networks. And on the one hand we will, in fact, find a way to honor the courage and dedication and talent of these young men and women, and we'll do it well. Whether it will be modeled off the 1991 thing, I don't know. I kind of doubt it, because it's such a different circumstance. Certainly, our war plan was not modeled off of 1991.",coming back,32,302
718,"Renowned UVA political scientist Larry Sabato this morning announced a $1,000,000 cash gift to the University of Virginia. The gift, payable over three years, is the largest ever given the university by an active faculty member, according to UVA President John Casteen. Sabato has written 23 books. Some of them have been read",gift,4,1871
1276,"the board is who decides that and board is so often chock full of the ceos golfing buddies, they serve on each other's boards and problem here is gap between what the average worker makes and ceo is making is increasing and everyone agrees that is not a good thing for this country, plus the fact, when the guys get the big packageses, so often you see the companies going down the zblubs thank you for updating us. back over to bill.",going down,28,460
313,"A second reason is Europe's growing worries about Islamic terrorism. The murder in November of Theo van Gogh, a provocative Dutch filmmaker, at the hands of an Islamic militant has been called Europe's 9/11. Though the two events are obviously not fully comparable, it is certainly true that American conservatives, such as Francis Fukuyama and Bernard Lewis, have found a wider audience recently for the idea that radical Islam is inimical to European traditions of tolerance. You mean those radical muslims can be kinda nasty sometimes",terrorism,0,1917
1102,"reporter: of course, pictures and videotape and a phone call is one thing. but seeing their son in person is quite another. and they are, of course, hoping that will happen very soon. young's mother says, when she sees her son, she plans on hugging him for a good solid half hour. back to you, judy.",sees,21,434
579,Y'all recently got bought,bought,2,694
353,The US-led coalition forces launched a new round of airstrikes on Baghdad at 2:30 p.m. (1130GMT) on Monday.,airstrikes,0,1504
984,"The dictator Suharto has fallen, the constitution has changed, the media was unshackled, democratic elections held, and East Timor freed. After Sept. 11, 2001, Indonesia was quick to sign onto U.S. President George W. Bush's global war on terror.",elections,17,1283
