,sentence,trigger,event_type,tag
1191,(()) -- You know who I would name,name,23,732
460,What do you think US policy should be toward Palestine now that Arafat has died,died,1,824
26,"Yesterday, there were scenes of jubilation in Baghdad, today, a suicide bombing and firefighters, grim reminders that, as U.S. Central Command put it, Baghdad is still an ugly place. CNN's John Irvine has this profile of a city literally teetering on a razor's edge.",bombing,0,279
1050,"My uncle declared bankruptcy in 2003 and his case closed in June 2004. If I give him shares in my corporation in Feb 2004 of my S Corporation making him 30% shareholder, and I finally distributed profit this year, will the creditors attempt to that take money from him in 2005",bankruptcy,19,1649
804,The protest follows a string of others involving tens of thousands of peace activists across Japan since January.,protest,10,1022
103,"All right, Wolf, and we will be watching. Thanks very much. Well, at the Pentagon briefing this afternoon, officials describing several units of the Republican Guard as effectively no longer being a credible fighting force. Let's get the very latest from the Pentagon for the overall war picture as they see it. Our Jamie McIntyre our senior military affairs correspondent is with us now. Hello, again, Jamie.",war,0,167
1002,"3. Bush Cabinet President Bush has just been elected to another term in office, and he has already started to appoint new people to his political cabinet as current members like Colin Powell and John Ashcroft resign.  Who would you like to see appointed to his cabinet next term",elected,17,742
898,"The FARC sought the exchange of more than 70 politicians, soldiers and policemen in its control for nearly 500 rebels imprisoned by the government, said Luis Devia, also known as Raul Reyes, a FARC leader, in a letter sent to the program Noticias Uno.",letter,15,1531
55,"... (UNINTELLIGIBLE) retention, for retention capability. So he goes down the hallway, and you can see once that's called clear, straight trigger finger, in case there's any sympathetic muscle tightening, there's no problem. You'll see another person come right up here, and he'll hold on this door, because that's not been cleared space yet, again, straight trigger finger, but ready to shoot if he needs to.",shoot,0,233
1219,The Supreme Court rejected earlier appeals for a case review from five of the convicts. The sixth offender has only made one appeal for a review.,appeals,25,1010
259,"``If U.S. forces seriously degrade Iraq's half-dozen Republican Guard divisions before that final battle, and only have to face perhaps 30,000 Special Republican Guard, fedayeen, and related personnel, the task will not be as hard as it might have been,'' he said.",battle,0,1482
323,"An explosion in a cafe at one of the capital's busiest intersections killed one woman and injured another Tuesday, police said.",explosion,0,1405
761,"Some of you may be wondering why there were two carousel organizations in the first place. The National Carousel Association was founded in the early 1970's by a group of art historians and collectors, including Frederick Fried, author of the 1964 book ""A Pictorial History of The Carousel"" that single-handedly gave the classic hand-carved wooden carousel the respect and appreciation it deserved. Other founders included Charlotte Dinger, who was already a major collector of carousel artwork at the time. The purpose of the NCA is ""to promote conservation, appreciation, knowledge and enjoyment of the art of the classic wooden carousel and especially the preservation of complete wooden carousels.""",founded,6,1703
744,"If my exwife doesn't dump B, maybe they'll wind up staying together, maybe even getting married. I think that would be nice. And they too will begin the process of rebuilding their ""together"" lives. I'm assuming there is some humanity beneath my exwife's narcicistic shell, but I do believe there is. B seems like a decent enough person too. So, B and my ex will be doing the same thing that I'm doing. Rebuilding their lives.",married,5,1583
530,"As mentioned in ""The Final Solution"" thread, the number of men killed for being homosexual was at the most 10-15,000. Now that's significant, but compared to the genocide of Jews and Zigeuner it's not as significant (though of course to the family and loved ones of those who died every single one is significant).",killed,1,1771
184,"of course, according to the guardian, she's very worried about that, too, and she has warned the court that she hopes the mother will be placed in a better home when all of this is over, one where she is far better protected than she was by the state in a home where police say she was raped. aaron",raped,0,667
958,"""...........are suing to overthrow the results of the governor's election is Washington State because there were some ""errors"" in the process. (They hollered ""fraud"" until they got to court, but unable to find any evidence with which to substantiate that charge they have backed down to ""errors"".)",election,17,1676
828,"Kristin Scott, the mother, told police she gave birth secretly to both babies at her parents' home in Byrds Creek, Richland County, one of unknown sex in April 2001 and the other, a fullterm girl, January 14.",birth,11,1132
638,"In Paris, the French media group said parent company chairman Jean-Rene Fourtou will replace Diller as chairman and chief executive of US unit.",replace,3,979
578,"Last Saturday night, rebels in the Central Africa Republic, captured the airport in the capital city of Bangui and the residence of  President Ange-Felix Patasse, who is out of the country.",captured,2,1499
314,"kay jones in waterford, connecticut, sure, let's invade iran. wior already over there, besides the biggest cost us to next to the loss of life is transporting our troops overseas. iraq, iran. it's only one letter off, we could call it a typo. a little cruel. bill in montana. nuclear weapons in iran, hope -- and buzz writes no one wants to see a war, but no one upons to see another september 11th even more. especially a nuclear september 11th. i would support military action in iran if it helps to stabilize that area of the world.",invade,0,661
1204,Television footage showed medical teams carting away dozens of wounded victims with fully armed troops on guard.,wounded,24,965
303,Police were investigating the cause of the explosion in the restroom of the multistory Crocodile Cafe in the commercial district of Kizilay during the morning rush hour. The blast shattered walls and windows in the building.,explosion,0,1406
458,Our country is great enough and strong enough to maintain the moral authority to convince the international community that we're right. I don't think we have to kill to prove that.,kill,1,90
712,"Russia has accepted a US$150 million World Bank loan to combat the spread of AIDS and tuberculosis, ending a negotiating process that lasted four years, World Bank officials said Friday.",loan,4,1259
115,Most analysts linked Russia's opposition to a war in Iraq to fears that it will lose oil contracts that were sealed with the now-toppled regime of Saddam Hussein.,war,0,1050
476,Walter Rodgers with the 3-7th. Just ahead we'll have the latest on today's suicide bombing in Israel. A report from CNN's Kelly Wallace when we return.,suicide,1,157
1552,"To the south, more black smoke over the town of Basra. British troops control the outskirts of the town, and today destroyed another building they said housed Iraqi fighters. There is much fear here of the Saddam loyalists who still hold sway in Basra and of the invading troops waiting at the gates. (on camera): The Americans are racing towards Baghdad, the British still seem anxious to make their progress here as measured as possible. Basra will fall. But there may first be fighting in the capital, 250 miles to the north. Tim Ewart, ITV News, southern Iraq.",invading,32,184
438,"Rep. Jeff Kottkamp, R-Cape Coral, said the bill reminded him of a sign he saw on a constituent's house while campaigning door-to-door. Kottkamp said the sign, next to a doorbell, showed a smoking .44-Magnum handgun and the words: ""We don't dial 911."" This is great news for Florida gun carriers because now to defend yourself you don't have to first make sure a ""duty to retreat"" is impossible. Currently, if one's life is threatened he/she must make sure it is impossible to escape before using deadly force on an attacker.",deadly,1,1846
1370,"the head of the catholic church in phoenix, arizona, bishop thomas o'brien has resigned. just one day after being charged with a felony. he is accused of leaving the scene of a fatal accident. earlier this month o'brien narrowly escaped prosecution over his handling of sexual abuse allegations against priests.",resigned,31,641
963,"Do you think the elections scheduled for January will take place, and if not, then what",elections,17,934
1534,"The waiver of extradition that she signed simply means that if she skips out and goes to another state, she can't contest the right of the original court to have her hauled back to its jurisdiction, and that the court won't have to initiate the time-consuming process of extraditing her. Instead, if the cops pick her up, she can be shipped back without delay.",skips,32,1635
1162,"If they are interested in setting up a meeting then have them contact me at 979-777-6445 or at laurouse...@yahoo.com and I will send the info to Tori, or have them contact Tori Foster to set up a time.",meeting,21,1618
1512,"-and she's going to have to fly back to Wisconsin, um-",fly,32,915
573,Amnesty opposes the death penalty for any crime.,death,1,1017
1041,"the story behind the defendants of tulia, texas, is our ""headlines timeline."" july 23rd, 1999 -- there was a massive drug bust in a predominately african-american neighborhood in tulia. of the 46 people arrested, 39 are african-american. the case against them was based on the testimony of undercover officer thomas coleman. coleman claimed he bought drugs from the defendants, but offered little or no supporting evidence. after the first of several trials ended with convictions and harsh sentences, most of the other defendants pleaded guilty to avoid hard time. march 17, 2003 -- with coleman's credibility under serious attack, new hearings for the tulia defendants get under way. the hearings are stopped when the judge, defense attorneys and prosecutors agree that coleman lied under oath and is a racist. coleman denies doing anything wrong. it took a special act of the texas legislature to clear the way for monday's release. but these men and the others caught up in the tulia tragedy are still convicted criminals. now it's up to the appeals court and the board of pardon and paroles to officially clear their names.",convictions,18,351
944,"well, the key here is the only way to get that kind of legitimate government to have it look good is to hold elections. but if you hold elections, you stop the whole process of building a rule of law, creating courts, creating administration. we've seen in the past in bosnia for example, you held elections and all of the old ethnic thugs get into power because they have organization and they have money and they stop the process of genuine building of democracy. there is this tension here which is the only way to make this look good is in some way get legitimate iraqi authority, but the faster you get that, the more likely you stop this process.",elections,17,428
679,"right now, aaron tonkin factors in no fewer than seven different federal and state investigations. one of them being an irs investigation into several million dollars worth of cash and gift that is he gave to many many hollywood celebrities.",gave,4,673
815,the struggle for power in a postsaddam iraq has begun. a key faction bidding for control announced it will protest the presence of a prominent iraqi exile leader. the head of the iraqi democratic movement says his group will hold a demonstration in nasiriyah to denounce the presence of ahmad chalabi. chalabi is the founder and leader of the iraqi national congress. he was escorted into iraq tuesday by u.s. marines. chalabi staged his own rally yesterday to support his bid to become the next leader of iraq.,protest,10,324
826,"The blood red nation of China is trying to curb the effects of a devastating 20-year-old policy that outlawed women from having more than one child. As a result, only about 100 girls are born for every 119 boys, because couples traditionally favor males.",having,11,1817
595,"and -- I am a driver -- and a loader and -- a lot of other stuff.  um I work for -- this guy named uh Joe, he was a regional -- bank manager for Wachovia for a few years.  and bought our company out from our previous owner.  um",bought,2,709
403,"In an April 30, 2001, Washington Times column, Nat Hentoff noted that the media have devoted ""scant mention"" to the ""plain fact that it was Mr. Annan, when he was head of the United Nation's peacekeeping office, who could have prevented the slaughter of 800,000 Tutsis and their sympathizers in Rwanda in 1994."" It's true, Hentoff said, that the U.N. issued a report in 1999 that acknowledged, to some extent, its role in the killings. But for five and a half years, he noted, Annan ""refused to accept any responsibility for the Rwandan holocaust until Mr. Gourevitch and others revealed that less than 5,000 U.N. troops could have stopped the killings if Mr. Annan had not closed his eyes."" It is astonishing that a journalist for NBC New would close her eyes to Annan's role. But that is what she was apparently paid to do.",slaughter,0,1926
1330,"The first thing that needs to happen is that Bettman and Goodenow (the players' association rep) need to be fired, deported, flogged, tarred and feathered and finally forced to pay for four tickets plus a program, four dogs, four beers, and two cokes and parking to a game at an NHL arena for every day of the next season so they understand what the fans go thru to see a hockey game.",fired,31,1978
1112,"Martha should do a reality show. Take 10 contestants, and give them a situation: You have company coming over for dinner; You're hosting an open house; or, You're hosting a wedding reception. Then, she just ranks them and eliminates one every week. The stock would really go to the moon on that press release.",coming over,21,1982
567,And you pick up the phone in the embassy. A voice on the other end of the line says he's a scientist with NOAA and that a tsunami is bearing down on your coastal villages and resorts. Thousands could die. How would you react to such a call,die,1,1561
771,"The litigation covers buyers in auctions outside the United States between January 1, 1993 and February 7, 2000, and sellers between September 1, 1995 and February 7, 2000.",litigation,8,970
1423,"``They admitted to having nuclear capability and weapons at this moment,'' said Rep. Curt Weldon, who headed a delegation of U.S. lawmakers that visited Pyongyang for three days ending Sunday. ``They admitted to an effort to expand their nuclear production program.''",visited,32,1436
912,"we get thousands of e-mail from our viewers every day. here's what some of you are saying as far as our coverage of the top stories is concerns. william writes this -- please continue to write to us. we love hearing from you. just go to our website, cnn.com/wolf. we read all of your e-mail. much more coverage of the new iraq and",e-mail,15,469
873,"if she lied, then that is the obstruction of justice charge. that's the criminal side. that's where the prison time comes in.",charge,13,591
728,"Hanover, 53, is host of a syndicated television show, ``Famous Homes and Hideaways.'' Last month, she and her fiance  _  an old high school sweetheart  _  invited the press along as they went shopping for wedding bands, saying they are planning a wedding in the New York City area this summer.",wedding,5,1359
856,"a former fbi informant accused of being a double agent has been indicted. the charges against katrina leung are the latest in an alleged case of sex, spies, and international intrigue. charles feldman is in los angeles with details on this one.",indicted,13,518
429,"i want to apologize to the american people for clearly making a misjudgment over the weekend by giving an interview to iraqi television. now, i said in that interview essentially what we all know about the war, there have been delays in implementing policy, there has been surprises. but clearly by giving that interview to iraqi television, i created a firestorm in the united states. and for that i am truly sorry.",war,0,399
640,"Yeah. Seventeen people employed there.  Um -- predominantly Hispanics work in the kitchen area.  They're uh -- well, actually, you know they're some of my cake decorators in the bakery area too. They're it's it's predominantly a Hispanic run organization. I'm not Hispanic, but they uh I've hired uh",hired,3,706
742,"I got a sort of an icky feeling when I realized the only people who did attend the kid's wedding was his unmedicated bi-polar mother and his father, who suffers from Alzheimers.",wedding,5,1569
1519,The premier of the western Canadian province of British Columbia pleaded no contest to driving drunk during a Hawaiian vacation in January.,vacation,32,1223
20,"``Nearly everybody in Indonesia sees this Iraq war as completely unnecessary and there is widespread public opposition to U.S. policies,'' said Jusuf Wanadi of the Center for Strategic and International Studies in Jakarta.",war,0,1290
116,"it's so soon -- since nine eleven, and he has been creating his own job, i- in essence, because it's such a new position.  But, I think it's -- it would've been -- better to have one person -- like continuing that.  However,",nine eleven,0,716
990,9. Elections Did you vote in the recent US Presidential election,election,17,854
1154,"In meetings with South Korean officials, Wolfowitz urged them to increase military spending on new technologies and telecommunications equipment, as U.S. forces have done. South Korea earmarks about US$14.5 billion for its military.",meetings,21,1444
1525,"And you know what, they did a hell of a job for our country. And these bozos let four armed Cubans land on our shores when they're trying to make a high terrorist alert. Our president has put homeland security in the hands of failed Republican hacks. Hire professionals, Mr. President.",land,32,3
65,"Blair also pleaded the world to avoid ""endless diplomatic wrangles"" over the future of Iraq like the international dispute over a second UN resolution on Iraq that preceded the war.",war,0,1520
684,"Best-selling novelist and ""Jurassic Park"" creator Michael Crichton has agreed to pay his fourth wife 31 million dollars as part of their divorce settlement, court documents showed Friday.",pay,4,1060
654,"I started there, and we only had -- it was only like maybe thirty kids that that came to the -- to the uh community center.  But now we got seventy-eight.",started,3,697
1287,"You know, we're close to the trial so of course it's going to be in the newspaper every single day.  So, it's, you know, and the trial, the, um,  what is it called, the verdict, was actually read by audio over the ~TV. So it it's pretty ((depressing))",trial,29,774
89,"Australian commandos, who have been operating deep in Iraq, destroyed a command and control post and killed a number of soldiers, according to the country's defense chief, Gen. Peter Cosgrove.",destroyed,0,1217
733,"In court papers filed this week in state Supreme Court in New York, Welch requested a deposition next month of David Heleniak, a senior partner in the law firm of Shearman & Sterling in New York. He also wants to subpoena all documents maintained in Jane Beasley Welch's personnel file by Shearman & Sterling, a prestigious corporate law firm where she worked before she married Welch.",married,5,1229
56,"Here in Washington, members of the House of Representatives come together to support America's armed forces. Up next: a live report on that ceremony and the latest efforts to pass a spending bill to pay for the war.",war,0,285
265,"bringing you up to date on a breaking story out of the middle east. in gaza, a pair of israeli gun ship attack, aerial attacks that have threatened to derail the road map to peace, as it is called. in the first attack, a car carrying rantissi, a senior member of the hamas group, a militant organization, was targeted. he survived, with wound, but two people were killed. 27 others were injured in that attack. the second attack occurred after some rocket firings aimed, apparently, toward the israelis, apparently in retaliation. we're checking our facts on that one. that is just unfolding. the white house saying, and the president directly quoted as saying, he was deeply troubled by that initial attack. still no reaction to the second attack. the details on that still inconclusive. the president, quoted by ari fleischer, his spokesman, is saying he's concerned the strike will undermine efforts by palestinian authorities to bring an end to terrorist attacks and does not contribute to the security of israel. clearly some frustration with the sharon government in israel in the wake of these attacks in gaza.",attacks,0,598
1596,Your gran- you go to your grandma's house.,go,32,902
186,"Yet, analysts argued, both Britain and the United States hope their agreed vision of a postwar scenario will placate anti-war nations such as France, Germany and Russia.",war,0,1519
92,"good evening. welcome, everyone. mike galanos is off tonight. our top story -- eric robert rudolph has officially said he didn't do it. he pleaded not guilty to bombing a birmingham women's clinic in 1998. the suspected serial bomber appeared in a federal courthouse tuesday afternoon. he is also suspected in three atlanta-area bombings. north carolina authorities say rudolph opened up to them about his five years on the run. he says he hunted wild animals, searched the trash for food, and covered himself with leaves to make it through the winters.",bombing,0,341
1451,-Immediate withdrawal of US and Iraqi security forces from the Anbar governorate and the handover of security responsibilities to former army officers from Anbar.,withdrawal,32,1939
291,"In Montreal, ""Stop the War,"" a coalition of more than 190 groups, said as many as 200,000 people turned out, though police refused to give a figure.",War,0,1004
1324,"martha stewart is one of those stories that is in the news big time again. she resigned as chairman and ceo of martha stewart living, omnimedia, the company that bears her name. after pleading not guilty to a laundry list of charges brought by the justice department and the sec, insider trading, obstruction of justice, conspiracy to hide what they say is an illegal stock sale, we're talking about 4,000 shares of stock that netted her about $225,000. how does this compare with other corporate scandals",resigned,31,580
1297,"Ummm, am I the only one that learned anything from the Michael Irvin drug trial of the mid 90's",trial,29,1951
1123,"""It was useful to get it all out on the table and see where we go from here,"" he said, referring to the April 23 to 25 discussions in Beijing.",discussions,21,1077
257,"To put it simply (for your benefit): Lincoln spoke *of* God, demonstrating the irony of a war fought between people with more similarities (their religious beliefs among them) than differences. Dubya spoke *for* God, demanding that we should all fall in line behind him, because he's got The Plan, and God's On His Side. Pure religious jingoism.",war,0,1718
96,Solana said the EU would help in the humanitarian crisis expected to follow an attack on Iraq. The EU is set to release 20 million euros (US$21.5 million) in immediate humanitarian aid for Iraq if war breaks out and may dip into an ``emergency reserve'' of 250 million euros (US$269 million) for humanitarian relief.,attack,0,1202
551,"People died, people in prison without court, without trial.",died,1,255
304,"Prof Gary Mauser said that Britain was making the same mistake as Canada and Australia in focusing on legal owners - a section of the law-abiding community where gun crimes, such as the Dunblane massacre, were aberrations .",massacre,0,1783
1208,Laser beams can temporarily blind or disorient pilots and possibly cause a plane to crash.,blind,24,1908
891,"-- Bill ""20/20 Hindsight"" Asher",call,15,1563
1134,"``I don't think we'll discover anything, myself,'' Rumsfeld said at a meeting with Pentagon employees. ``I think what will happen is we'll discover people who will tell us where to go find it.''",meeting,21,1308
1150,"more than a million babies awaiting adoption in china today. a california family is now bigger by one. tonight they're welcoming little abby kramer in the world was anything but simple. her new mom and dad had to contend with international red tape, traveling thousands of miles to meet the new addition and cope with the sars crisis going on in china. their story is remarkable. thelma gutierrez telling the story of the kramers meeting kramer.",meeting,21,630
1477,reporter: still they have concerns. they're heading to quinn joe.,heading,32,632
570,My question is not who votes at the U.N. Who sends troops to die on our side,die,1,101
1164,"TV2, quoting Toefting's lawyer Anders Nemeth, reported that that 33-year-old midfielder was ready to serve his sentence immediately.",sentence,22,1252
5,"now, you are expert of preemptive strike...LOL",strike,0,1745
819,"Organisers claimed that some 250,000 people attended the rally, creating a human column some three kilometres (1.8 miles) long. Police put the attandance at around 125,000.",rally,10,986
1183,"The court ruling stated that the verdict and sentence would be submitted to the National Press Council, a government-appointed body, for approval, Ngor said.",sentence,22,1383
